{
  "schema_version": 1,
  "phase": "implementation",
  "phase_note": "Implementation is authorized. Authorization is a decision, not evidence: nothing in this record asserts that any component is implemented, secure, complete, or launch-ready.",
  "recorded_at": "2026-08-05",
  "finding_registry": "conformance/p1140f/semantic-findings-v1.json",
  "open_p1_baseline": {
    "severity": "P1",
    "count": 13,
    "rule": "non-regression",
    "counted_states": ["open", "repair-in-progress", "repaired-pending-review"],
    "recorded_at": "2026-08-05",
    "reference": "https://github.com/vedant-simulacrum/vibemaxxing/issues/44",
    "note": "Validators fail when the open P1 count exceeds this ceiling and pass when it is at or below it. Closing a finding must never turn validation red. Lowering this ceiling after a finding closes is optional and manual; it is never required to keep validation green."
  },
  "registry_summary_documents": [
    "docs/project/STATUS.md",
    "docs/planning/TASK_CATALOG.md",
    "docs/planning/P1140F_SEMANTIC_REVIEW_AND_STANDARDS_MAPPING.md"
  ],
  "open_p1_claim_patterns": [
    "([0-9]+) active P1 clusters",
    "P1 clusters open: ([0-9]+)"
  ],
  "gates": [
    {
      "gate": "P-1140E",
      "state": "complete-planning",
      "authorization": null,
      "documents": [
        {
          "path": "docs/planning/P1140E_FINAL_CONTRADICTION_AUDIT_2026-07-24.md",
          "requires": ["structural P0 open: 0", "structural P1 open: 0", "semantic", "P-1140F"],
          "forbids": []
        },
        {
          "path": "AGENTS.md",
          "requires": ["P-1140E", "complete-planning"],
          "forbids": []
        }
      ]
    },
    {
      "gate": "P-1140F",
      "state": "in-progress-planning",
      "authorization": null,
      "documents": [
        {
          "path": "docs/project/STATUS.md",
          "requires": ["planning contract repair", "P-1140F", "in-progress-planning", "semantic-findings-v1.json"],
          "forbids": []
        },
        {
          "path": "docs/planning/TASK_CATALOG.md",
          "requires": ["P-1140E", "complete-planning", "P-1140F", "in-progress-planning", "SR-005", "SR-017"],
          "forbids": []
        },
        {
          "path": "docs/planning/P1140F_SEMANTIC_REVIEW_AND_STANDARDS_MAPPING.md",
          "requires": ["SR-005", "SR-017", "in-progress-planning"],
          "forbids": []
        },
        {
          "path": "docs/implementation/IMPLEMENTATION_HANDOFF.md",
          "requires": ["P-1140F"],
          "forbids": []
        },
        {
          "path": "AGENTS.md",
          "requires": ["P-1140F", "in-progress-planning", "SR-005", "SR-017", "semantic-findings-v1.json"],
          "forbids": []
        }
      ]
    },
    {
      "gate": "P-1104",
      "state": "authorized-open",
      "authorization": {
        "authorized_by": "vedant-simulacrum",
        "authorized_at": "2026-08-05",
        "reference": "https://github.com/vedant-simulacrum/vibemaxxing/issues/44",
        "reference_kind": "github-issue",
        "open_p1_findings_at_authorization": 13,
        "findings_open_at_authorization": [
          "SR-005",
          "SR-006",
          "SR-007",
          "SR-008",
          "SR-009",
          "SR-010",
          "SR-011",
          "SR-012",
          "SR-013",
          "SR-014",
          "SR-015",
          "SR-016",
          "SR-017"
        ],
        "opened_with_open_findings": true,
        "findings_waived": false,
        "preconditions_met": false,
        "acknowledgement": "P-1104 was opened by owner decision while 13 P1 semantic findings (SR-005 through SR-017) were open and conformance/p1140f/review-target-v1.json was not-pinned with a pending verdict. The documented preconditions were not met; they were knowingly accepted, not satisfied. The findings remain open and tracked in conformance/p1140f/semantic-findings-v1.json and are not waived. Opening this gate authorizes implementation work and is not evidence that any component is implemented, correct, secure, private, certified, or launch-ready.",
        "stated_rationale": "The open findings are contradictions between documents whose closure is largely unfalsifiable without running code; most become testable once behaviour exists."
      },
      "documents": [
        {
          "path": "docs/project/STATUS.md",
          "requires": ["P-1104", "authorized-open", "gate-authorization-v1.json", "not waived"],
          "forbids": [
            "implementation remains unauthorized",
            "P-1104 remains blocked",
            "product implementation remains prohibited"
          ]
        },
        {
          "path": "docs/planning/TASK_CATALOG.md",
          "requires": ["P-1104", "authorized-open", "gate-authorization-v1.json"],
          "forbids": ["| P-1104 | Enter implementation phase | blocked-approval |"]
        },
        {
          "path": "docs/planning/P1140F_SEMANTIC_REVIEW_AND_STANDARDS_MAPPING.md",
          "requires": ["P-1104: authorized-open", "gate-authorization-v1.json"],
          "forbids": ["P-1104: blocked", "product implementation: unauthorized"]
        },
        {
          "path": "docs/implementation/IMPLEMENTATION_HANDOFF.md",
          "requires": ["P-1104", "authorized-open", "gate-authorization-v1.json"],
          "forbids": ["inactive while P-1140F is open", "P-1104 remains blocked"]
        },
        {
          "path": "AGENTS.md",
          "requires": ["P-1104", "authorized-open", "gate-authorization-v1.json", "not waived"],
          "forbids": [
            "P-1104 remains blocked",
            "product implementation remains unauthorized",
            "implementation remains unauthorized",
            "not allowed until explicit P-1104 authorization"
          ]
        }
      ]
    }
  ]
}
